{
  "schemaVersion": 1,
  "fidelity": "recon",
  "diagonalScaleFp": 218,
  "puffTicks": 12,
  "hurtFlashTicks": 6,
  "walkTicksPerFrame": 6,
  "creatures": [
    {
      "id": "tribesman", "displayName": "Tribesman", "sprite": "creature_tribesman",
      "size": { "w": 16, "h": 24 }, "collisionBox": { "x": -6, "y": -10, "w": 12, "h": 10 },
      "speed": { "xFp": 320, "yFp": 218 }, "hp": 1, "score": 150, "ignoresScenery": false,
      "behaviour": { "kind": "LINEAR_BOUNCE", "params": { "reverseChancePer10k": 40 } }
    },
    {
      "id": "spearman", "displayName": "Spear Tribesman", "sprite": "creature_spearman",
      "size": { "w": 16, "h": 24 }, "collisionBox": { "x": -6, "y": -10, "w": 12, "h": 10 },
      "speed": { "xFp": 256, "yFp": 179 }, "hp": 1, "score": 250, "ignoresScenery": false,
      "behaviour": { "kind": "PATROL_THROW", "params": { "reverseChancePer10k": 40, "throwPeriodTicks": 90, "throwRangePx": 160, "throwConeCos10k": 7071 } }
    },
    {
      "id": "chief", "displayName": "Village Chief", "sprite": "creature_chief",
      "size": { "w": 16, "h": 28 }, "collisionBox": { "x": -6, "y": -10, "w": 12, "h": 10 },
      "speed": { "xFp": 358, "yFp": 243 }, "hp": 2, "score": 400, "ignoresScenery": false,
      "behaviour": { "kind": "CHASE_AXIS", "params": { "minorAxisScaleFp": 128 } }
    },
    {
      "id": "scorpion", "displayName": "Scorpion", "sprite": "creature_scorpion",
      "size": { "w": 12, "h": 10 }, "collisionBox": { "x": -5, "y": -6, "w": 10, "h": 6 },
      "speed": { "xFp": 512, "yFp": 358 }, "hp": 1, "score": 200, "ignoresScenery": false,
      "behaviour": { "kind": "WANDER_ERRATIC", "params": { "rerollMinTicks": 4, "rerollRandomTicks": 8 } }
    },
    {
      "id": "snake", "displayName": "Snake", "sprite": "creature_snake",
      "size": { "w": 20, "h": 8 }, "collisionBox": { "x": -9, "y": -6, "w": 18, "h": 6 },
      "speed": { "xFp": 230, "yFp": 154 }, "hp": 1, "score": 150, "ignoresScenery": false,
      "behaviour": { "kind": "WALL_FOLLOW", "params": {} }
    },
    {
      "id": "spider", "displayName": "Spider", "sprite": "creature_spider",
      "size": { "w": 12, "h": 12 }, "collisionBox": { "x": -5, "y": -10, "w": 10, "h": 10 },
      "speed": { "xFp": 154, "yFp": 384 }, "hp": 1, "score": 200, "ignoresScenery": true,
      "behaviour": { "kind": "DROP_THREAD", "params": { "triggerPx": 24, "dropMaxPx": 120, "pauseTicks": 30, "ascendScaleFp": 128 } }
    },
    {
      "id": "bat", "displayName": "Bat", "sprite": "creature_bat",
      "size": { "w": 14, "h": 10 }, "collisionBox": { "x": -6, "y": -8, "w": 12, "h": 8 },
      "speed": { "xFp": 410, "yFp": 282 }, "hp": 1, "score": 300, "ignoresScenery": true,
      "behaviour": { "kind": "SINE_FLIGHT", "params": { "amplitudePx": 28, "periodTicks": 70 } }
    },
    {
      "id": "frog", "displayName": "Jungle Toad", "sprite": "creature_frog",
      "size": { "w": 12, "h": 12 }, "collisionBox": { "x": -5, "y": -8, "w": 10, "h": 8 },
      "speed": { "xFp": 640, "yFp": 435 }, "hp": 1, "score": 100, "ignoresScenery": false,
      "behaviour": { "kind": "HOP", "params": { "hopTicks": 8, "restTicks": 20, "towardPlayerPer10k": 6000 } }
    },
    {
      "id": "vulture", "displayName": "Vulture", "sprite": "creature_vulture",
      "size": { "w": 20, "h": 14 }, "collisionBox": { "x": -8, "y": -10, "w": 16, "h": 10 },
      "speed": { "xFp": 461, "yFp": 307 }, "hp": 1, "score": 350, "ignoresScenery": true,
      "behaviour": { "kind": "CHASE_AXIS", "params": { "minorAxisScaleFp": 128 } }
    },
    {
      "id": "boar", "displayName": "Warthog", "sprite": "creature_boar",
      "size": { "w": 22, "h": 16 }, "collisionBox": { "x": -10, "y": -10, "w": 20, "h": 10 },
      "speed": { "xFp": 358, "yFp": 256 }, "hp": 2, "score": 400, "ignoresScenery": false,
      "behaviour": { "kind": "AMBUSH_BURST", "params": { "triggerPx": 96, "chargeSpeedFp": 768, "chargeTicks": 40, "stunTicks": 24 } }
    },
    {
      "id": "rhino", "displayName": "Rhino", "sprite": "creature_rhino",
      "size": { "w": 28, "h": 20 }, "collisionBox": { "x": -13, "y": -12, "w": 26, "h": 12 },
      "speed": { "xFp": 307, "yFp": 218 }, "hp": 3, "score": 500, "ignoresScenery": false,
      "behaviour": { "kind": "CHASE_DIRECT", "params": { "turnCooldownTicks": 12, "stallTicks": 8 } }
    },
    {
      "id": "hippo", "displayName": "Hippo", "sprite": "creature_hippo",
      "size": { "w": 30, "h": 22 }, "collisionBox": { "x": -14, "y": -13, "w": 28, "h": 13 },
      "speed": { "xFp": 205, "yFp": 141 }, "hp": 3, "score": 450, "ignoresScenery": false,
      "behaviour": { "kind": "LINEAR_BOUNCE", "params": { "reverseChancePer10k": 20 } }
    },
    {
      "id": "wildebeest", "displayName": "Wildebeest", "sprite": "creature_wildebeest",
      "size": { "w": 24, "h": 18 }, "collisionBox": { "x": -11, "y": -10, "w": 22, "h": 10 },
      "speed": { "xFp": 435, "yFp": 307 }, "hp": 1, "score": 250, "ignoresScenery": false,
      "behaviour": { "kind": "HERD_BOUNCE", "params": { "herdSize": 3, "spreadPx": 20, "reverseChancePer10k": 30 } }
    }
  ],
  "projectiles": [
    {
      "id": "spear", "displayName": "Spear",
      "speedFp": 640, "lengthPx": 12, "collisionBox": { "x": -3, "y": -3, "w": 6, "h": 6 },
      "score": 50, "maxTicks": 150
    }
  ]
}
